Product URL,Product Name,Product Price,Rating,Number of Reviews,Description,ASIN,Manufacturer
https://www.amazon.in/NORTH-ZONE-Lightweight-Backpacks-Stylish/dp/B0BL3SDSGZ/ref=sr_1_190?crid=2M096C6104MLT&keywords=bags&qid=1690126635&sprefix=ba%2Caps%2C283&sr=8-190,NORTH ZONE Lightweight school bags Backpacks for Boys Girls Stylish men and women Casual Travel Laptop Bag College office  ,630,3.9 out of 5 stars,830,"COMPATIBLE WITH 15.6 INCH LAPTOP”: The Northzone Backpack fits up to 15.6 inch laptop. Dimensions: 34cm x 15cm x 45.5cm; Weight: 499gHIGH QUALITY, DURABLE AND WATER REPELLANT FABRIC”: This backpack features in durable snow yarn polyester fabric and streamlined design with a padded interior to protect notebooks and important itemsCONVENIENT TRAVEL"" Adjustable shoulder strap and padded laptop compartment together with a quilted back panel make it comfortable for all-day useCONVENIENTLY PLACED PADDED LAPTOP COMPARTMENTS AND POCKETS: The padded interior helps protect notebooks and important items. Quick access zippered front pocket for added storage. A quilted back panel make it comfortable for all-day use.HIGH QUALITY, CASUAL YET STYLISH DESIGN"": very attractive and perfect for school, travel and outdoor activities. The perfect backpack for those needing stylish all-day protection for their laptop.",B0BL3SDSGZ,Northzone
https://www.amazon.in/ADISA-Laptop-Backpack-Office-College/dp/B0BXQZ6Q85/ref=sr_1_191?crid=2M096C6104MLT&keywords=bags&qid=1690126635&sprefix=ba%2Caps%2C283&sr=8-191,ADISA Large Laptop Backpack Office Bag College Travel Back Pack with USB (Black)  ,599,3.9 out of 5 stars,81,Material: High Quality Polyester1 large compartment and 1 easy-access pocketLaptop Size: 15.6 inch and belowDimensions: LxWxH - 12 x 4.5 x 17 inchesUSB / Reflector Logo / Adjustable Padded Shoulder Straps / Bottle holder / Padded Top Handle,B0BXQZ6Q85,ADISA
https://www.amazon.in/SPENZ-BAGS-Backpack-Raincover-Mahogany-Brown/dp/B0C3RN6QSC/ref=sr_1_192?crid=2M096C6104MLT&keywords=bags&qid=1690126635&sprefix=ba%2Caps%2C283&sr=8-192,"SPENZ BAGS Travel Laptop Backpack for Women & Men|Carry On Bag, College & School Students Bookbag With Raincover  ",999,4.2 out of 5 stars,120,"Care Instructions: Hand Wash OnlyLARGE CAPACITY & MANY POCKETS: This backpack has two main compartment pockets. One separate laptop compartment holds 15.6 Inch Laptop as well as 15 Inch, 14 Inch and 13 Inch Mac book or Laptop. The other one packing compartment is roomy for daily necessities and tech electronics accessories. Front compartment with zipper pocket and 2 elastic mesh side pockets.Make your items organized and easier to find.COMFY & BREATHABLE BACKPACK: Adjustable shoulder straps and back side comes with comfortable and breathable mesh design, relieves the stress of your shoulder. A comfortable airflow foam-pad back design with soft, multi-panel breathable mesh padding, offer your back maximum back support. A foam-padded top handle for a long time carry on.HIGH QUALITY MATERIAL: Our backpack made of waterproof and quality Polyester fabric with metal zippers. Lightweight and sturdy, ensure a secure & long-lasting usage every day. Perfects for weekend getaways, shopping, office work, business traveling and other outdoor activities. Also, it is a perfect student’s backpack for women, men, teens, boys and girls.LAPTOP PROTECTION: Separate laptop compartment with foam padded of this back pack offers the optimal protection for your 15.6 inch laptop. Mesh pockets for mouse, adapter, charging cord and other electronics. Take the worry out of your work and study.IDEAL GIFT: This fashionable backpack can be a great companion for travel, business, everyday use and outdoor activities. Also, a perfect college high school student backpack for boys, girls, teens. Practical gifts for teens, boys, girls, friends, mother, father, her or him.",B0C3RN6QSC,Spenz Bags
https://www.amazon.in/FATMUG-Laptop-Bag-Men-Convertible/dp/B084LFS4G1/ref=sr_1_193?crid=2M096C6104MLT&keywords=bags&qid=1690126635&sprefix=ba%2Caps%2C283&sr=8-193,FATMUG Laptop Bag For Men - Convertible Backpack For Office And Travel (Navy Blue Oxford Fabric)  ,"1,599",4.4 out of 5 stars,"2,170","PRACTICAL AND ELEGANT:Made with Oxford Fabric, a stylish laptop bag for daily travel and short trips<br>; Age Range Description: Adult; Style Name: Travel Backpacks; Pocket Description: Utility Pocket; Special Features: Laptop Compartment<br><br>Pocket Description: Utility Pocket; Special Features: Laptop Compartment; Style Name: Travel Backpacks; Age Range Description: Adult<br>Compartment Description: Greater Than 17 Inches; Water Resistance Level: Water Resistant<br>",,
https://www.amazon.in/uppercase-Professional-resistant-sustainable-Anti-theft/dp/B0BR1C59R8/ref=sr_1_194?crid=2M096C6104MLT&keywords=bags&qid=1690126635&sprefix=ba%2Caps%2C283&sr=8-194,"uppercase SealPro Professional Laptop Backpack (15.6 Inch) 3x more water resistant sustainable bags with rain proof zippers & Anti-theft for Men, Women, Boys and Girls, 750 Days warranty  ","1,900",4.6 out of 5 stars,69,"Care Instructions: Wipe with Damp ClothHandcrafted with care and made up of premium quality robust materialPadded anti-theft laptop compartment fits up to 15.6"" Laptop, Back padding with Air mesh; Pocket under flap and 2 mesh pocket inside main compartment with a bottle holder on the sideWrinkle free bag and 3x more water resistant with Rainproof zippers; Trolley sleeve to securely place the bags on the luggage; Top Slip In PocketGRS certified for sustainability; The GRS (Global Recycled Standard) is intended for use with any product that contains at least 50% Recycled Material (License No. CMPY-158596); 750 days of international warranty",B0BR1C59R8,Acefour Accessories Pvt. Ltd.
https://www.amazon.in/TAGPR-cosmetic-Multifunctional-Organizer-Household/dp/B0978DL55J/ref=sr_1_195?crid=2M096C6104MLT&keywords=bags&qid=1690126635&sprefix=ba%2Caps%2C283&sr=8-195,"TAGPR cosmetic bag for women travel & Multifunctional Extra Large Cosmetic Bag with Hook for Travel, Makeup Organizer, Cosmetic Pouch, Household Grooming Kit, Makeup Bag For Men Women  ",319,4.1 out of 5 stars,99,"Multi Function - Multiple compartments for different requests of storage, strong long lasting zippers. The bag will keep your toiletry accessories safe, it's easy to access them, quicker and more convenient; folds up for easy storage and travel. Everything is easy to find.Large Capacity - Convenient to carry your toiletries, Cosmetic, Shaving, Travel Accessories and your personal items. The durable hook is convenient for hanging the toiletry bag wherever in the hotel or in the tent for space saving.Always use the Material of the best Quality - High quality nylon fabric, Use of portable, waterproof wear resistance, high elasticity.Pattern Name: Floral; Age Range Description: Adult",B0978DL55J,TAGPR
https://www.amazon.in/Gear-Executive-Anti-Theft-Backpack-BKPPKREXE0101/dp/B097KCMQKG/ref=sr_1_196?crid=2M096C6104MLT&keywords=bags&qid=1690126635&sprefix=ba%2Caps%2C283&sr=8-196,Gear Parker 23L Water Resistant Anti Theft Laptop Bag/Backpack for Men/Women - Black  ,644,4.3 out of 5 stars,424,"Care Instructions: Hand Wash OnlyErgonomically Designed : Spacious with Multiple Compartments & Pockets : Intuitive Access : Cushioned Back Panel & Shoulder Straps : LightweightPremium Anti-Scratch Faux Leather : Bartacked Load Points : Water Resistant Fabric : Heavy Duty Long Lasting ZippersPadded Velcro'ed Sleeve fits upto 15.6"" Laptop : Padded BaseSecret Anti-Theft Pocket with Slot for Charging WireAge Range Description: Adult; Lining Description: Polyester; Color Name: Black-Black",B097KCMQKG,Gear
https://www.amazon.in/sspa/click?ie=UTF8&spc=MTo4Mjc5NjY3ODI2OTA3NDI2OjE2OTAxMjY2MzU6c3BfYnRmOjIwMTI1ODk5OTIwNjk4OjowOjo&url=%2Fuppercase-Professional-Backpack-resistant-sustainable%2Fdp%2FB0BWNBQXDZ%2Fref%3Dsr_1_197_sspa%3Fcrid%3D2M096C6104MLT%26keywords%3Dbags%26qid%3D1690126635%26sprefix%3Dba%252Caps%252C283%26sr%3D8-197-spons%26sp_csd%3Dd2lkZ2V0TmFtZT1zcF9idGY%26psc%3D1,"uppercase Apex Professional Laptop Backpack (15.6 Inch) 3x more water resistant sustainable bags with rain proof zippers for Men, Women, Boys and Girls, 750 Days warranty  ","1,800",4.3 out of 5 stars,66,"Care Instructions: Wipe with Damp ClothHandcrafted with care and made up of premium quality robust materialPadded laptop compartment fits up to 15.6"" Laptop, Back padding with Air mesh; Front access pocket for you to easily carry important small items with a bottle holder on the sideWrinkle free bag and 3x more water resistant with Rainproof zippers; Trolley sleeve to securely place the bags on the luggage; Top Slip In PocketGRS certified for sustainability; The GRS (Global Recycled Standard) is intended for use with any product that contains at least 50% Recycled Material (License No. CMPY-158596); 750 days of international warranty",B0BWNBQXDZ,Acefour Accessories Pvt. Ltd.
https://www.amazon.in/sspa/click?ie=UTF8&spc=MTo4Mjc5NjY3ODI2OTA3NDI2OjE2OTAxMjY2MzU6c3BfYnRmOjIwMTYzODM2MDk0ODk4OjowOjo&url=%2FWALKENT-Darwstring-Waterproof-Resistant-Exterior%2Fdp%2FB0BRYDDG1L%2Fref%3Dsr_1_198_sspa%3Fcrid%3D2M096C6104MLT%26keywords%3Dbags%26qid%3D1690126635%26sprefix%3Dba%252Caps%252C283%26sr%3D8-198-spons%26sp_csd%3Dd2lkZ2V0TmFtZT1zcF9idGY%26psc%3D1,"WALKENT Stylish 15.6 inches Laptop Bag - Waterproof & Scratch Resistant Exterior for Office, College, Men, Women  ","1,989",4.6 out of 5 stars,9,"WATER RESISTANT & SCRATCH RESISTANT – Oxford Fabric Outer material is scratch r& water resistant. Covering Flap with tight zipper makes this bag almost waterproofSPECIAL DESIGN FLAP CLOSURE WITH HOOKS - Two toned special design and button hook closure makes this bag attractive and stylishANTI THEFT POCKET – A specially designed pocket at the back of the back makes a perfect place to keep your wallet, mobile etc.. and safe from theftSTYLISH & FASHIONABLE – Two tone colour with PU material on top and bottom makes this bag highly attractive and stylishMULTIPLE APPLICATIONS - Perfect for Travel, Business, Daily use, Casual use, School, College, Office. Fits 15.6 inch laptop, tablets and more",B0BRYDDG1L,Walkent OEM Baoding
https://aax-eu.amazon.in/x/c/RFnuoAtFSxYxNxzIwFTdFZUAAAGJg2XQMQMAAAH2AQBvbm9fdHhuX2JpZDIgICBvbm9fdHhuX2ltcDEgICCASL1X/https://www.amazon.in/Sirona-Sanitary-Napkin-Diapers-Disposal/dp/B01NAZVN8M/ref=sxbs_sbv_search_btf?content-id=amzn1.sym.880c6186-3832-495e-9caa-7ecfb2f5e88c%3Aamzn1.sym.880c6186-3832-495e-9caa-7ecfb2f5e88c&crid=2M096C6104MLT&cv_ct_cx=bags&keywords=bags&pd_rd_i=B01NAZVN8M&pd_rd_r=b8fd451a-82c6-49be-bf4f-5fe8e664fa02&pd_rd_w=1KPIc&pd_rd_wg=q4MPO&pf_rd_p=880c6186-3832-495e-9caa-7ecfb2f5e88c&pf_rd_r=4W8BG9QWC4AJM89T2DJQ&qid=1690126635&sbo=RZvfv%2F%2FHxDF%2BO5021pAnSA%3D%3D&sprefix=ba%2Caps%2C283&sr=1-177-06195d41-65bd-48f4-8e70-03d97b6094ec,"Sirona Sanitary Disposal Bags | 75 Bags | Pad Disposable Bags for Discreet Disposal of Tampons, Condoms, Diaper, Sanitary Pads, Panty Liner & Personal Hygiene Waste (Green)  ",211,4.5 out of 5 stars,"2,922","100% OXO-BIODEGRADABLE: The materials used to make these bags are 100% eco-friendly. They are oxo-biodegradable which means that they break down in the open environment like nature’s wastes but quicker and without leaving any toxic residues or plastic fragments behind.TEAR-RESISTANT: Sirona’s ‘I Love Clean’ Disposable Sanitary Bags are made using extra-durable plastic. It has thick double seams to hold your waste in- without ending up with rips and tears.SUPER-SEALED: The Sirona Sanitary Disposal Bags come with built-in glue which seals perfectly. The leak-proof design keeps the bacteria and wetness where it belongs making your surroundings safe and hygienic.MULTIPURPOSE: These oxo-biodegradable bags from Sirona are large enough for the hygienic and sanitary disposal of used feminine hygiene items, baby diapers, adult diapers, wet wipes and the disposable PeeBuddy.ODOUR-LOCK: Lock the smells of your waste in- just stick and seal to cancel out any unpleasant odours that have the possibility of emanating from these disposable bags. This is perfect for when you are travelling and can’t bin the waste.",First Step Digital Pvt Ltd,1 February 2017
https://www.amazon.in/sspa/click?ie=UTF8&spc=MTozMzEyNDQxODQ1MjI5NjQ4OjE2OTAxMjY3Mzc6c3BfYXRmX25leHQ6MzAwMDEzMzQyOTgzODMyOjowOjo&url=%2FPolice-Polyester-laptop-casual-backpack%2Fdp%2FB09CQ5T3LN%2Fref%3Dsr_1_193_sspa%3Fcrid%3D2M096C6104MLT%26keywords%3Dbags%26qid%3D1690126737%26sprefix%3Dba%252Caps%252C283%26sr%3D8-193-spons%26sp_csd%3Dd2lkZ2V0TmFtZT1zcF9hdGZfbmV4dA%26psc%3D1,POLICE Backpack for Men Casual Laptop Bag Office/Travel/College 30 Ltr Hedge Polyester - Black  ,"1,399",4.1 out of 5 stars,"5,733",Care Instructions: Hand Wash Only,Backpack,B09CQ5T3LN
https://www.amazon.in/sspa/click?ie=UTF8&spc=MTozMzEyNDQxODQ1MjI5NjQ4OjE2OTAxMjY3Mzc6c3BfYXRmX25leHQ6MjAxNjcxNTQ5ODEyOTg6OjA6Og&url=%2FEUME-Tourismo-Backpack-Resistance-15-6-inch%2Fdp%2FB0B4JQSMD5%2Fref%3Dsr_1_194_sspa%3Fcrid%3D2M096C6104MLT%26keywords%3Dbags%26qid%3D1690126737%26sprefix%3Dba%252Caps%252C283%26sr%3D8-194-spons%26sp_csd%3Dd2lkZ2V0TmFtZT1zcF9hdGZfbmV4dA%26psc%3D1,EUME Tourismo 36L Laptop Backpack Bag with 2 Large Compartment for Work Office & Business Travel for Men & Women | Water Resistance | Fit Up to 16 Inch Laptop  ,"2,499",4.4 out of 5 stars,7,"2 Large Compartments 1 Easy access front Pocket with organizer section & 2 mesh side pocketCapacity : 36 L ; Dimensions : 13X9X19 Inch (LXWXH)Pretty much everything on this backpack is heavily padded. The laptop compartment is also super protective, so there's no need to worry about your laptop getting all banged and damaged. These bags are made of long lasting fabric and their stylish designs help you to make the best impression. It's features are such to make sure that every day is bright and organized.Laptop pocket designed for your laptops to give them maximum security. It comes with Ipad Pocket and Pen Pocket which aids in organising your things systematically. A comfortable breathable back and straps to strengthen your shoulder and hence ensures durability.A roller bag sleeve added feature to make your travelling even more comfortable and convenient. It is water resistance also so that your backpack never loses its good look.",B0B4JQSMD5,EUME Lifetsyle Pvt Ltd
https://www.amazon.in/Lunars-Heritage-Casual-Bagpack-College/dp/B08CBJDBH4/ref=sr_1_195?crid=2M096C6104MLT&keywords=bags&qid=1690126737&sprefix=ba%2Caps%2C283&sr=8-195,Lunar's Heritage 37L Casual Water Resistant 3 Compartment Travel Bagpack/College Backpack/School Bag (Black)  ,799,4.0 out of 5 stars,877,"?WATER RESISTANT WITH 1 YEAR WARRANTY - Stylish and durable backpack for school /college, daily casual use and travel. . Size: 18.5 inch X 13.5 inch X 9 inch. Capacity : 37 liters. Backpack is made of high grade water resistant polyester material that gives it strength and durable for long-term use. 12 months warranty for any manufacturing defects<br><br> <br>?MADE IN INDIA - This “MAKE IN INDIA” Product features 3 large zippered compartments, 1 long zip pocket at front, 1 water bottle /umbrella pocket. Suitable for casual usage , school / college / office n travel.; ?LOTS OF STORAGE SPACE - Front compartment has space for keeping Tiffin box. Front pocket gives easy access to wallet / key chains/ stationery.<br><br> <br>?LOTS OF STORAGE SPACE - Second and third compartment are very spacious for keeping long Books, files, binders and spacious enough to hold your Travel / Trip cloths. The base is made with 100% super strong 900D polyester fabric to protect your bag during daily use<br><br> <br>?COMFY&STURDY - Comfortable airflow back design with thick but soft multi-panel ventilated padding, gives you maximum back support. Breathable and adjustable shoulder straps relieve the stress of shoulder. Padded handle and Reinforced haul loop for quick grab<br>; Age Range Description: Kid; Special Features: Water Bottle Umbrella Pouch<br>; Special Features: Water Bottle Umbrella Pouch; Age Range Description: Kid <br>Pattern Name: Solid <br>",B08CBJDBH4,Lunar's
https://www.amazon.in/Tabelito-NEXA-Backpack-Business-Compartment/dp/B0C2D4T9R5/ref=sr_1_196?crid=2M096C6104MLT&keywords=bags&qid=1690126737&sprefix=ba%2Caps%2C283&sr=8-196,"Tabelito® NEXA 3O L Water Resistant Laptop/College/Office/School/Travel/Business Bag, Unisex Backpack for Men Women Fits Up to 15.6 Inch Laptop Notebook. (GREY)  ",399,4.3 out of 5 stars,76,"Care Instructions: Hand Wash OnlyThe front and side zipper compartments of the backpack make it simple to store items like tablets, diaries, pens, pencils, smartphones, cards, change and other small items. The backpack's side pockets make it easy to carry along tiny goods like mini umbrellas and water bottles.MADE IN INDIA - This ""MAKE IN INDIA"" laptop bag for men has 2 front zip pockets, 2 side bottle pockets, and 1 huge zipped section. For men, women, boys, and girls, this bag works great for the office, school, and college. In fact, it's the ideal all-purpose backpack for men, school bags for girls and boys, college bags for girls and boys and workplace bags for unisexLAPTOP BACKPACK SPECIFICATIONS - Men's NEXA Laptop Backpack; Compartment Size: Up to 15.6 Inches. 30 litres is the capacity. 15 x 11.5 x 3 inches in size.NEXA padded laptop backpack with internal organiser and sleeve that can handle up to 15.6"" laptops. Compatible laptops include those made by HP, Lenovo, Acer, ASUS, and Dell. Your keys, cords, office supplies, and other valuables can be neatly organised inside the organiser to avoid theft.The Tabelito Casual Backpack is entirely produced in India and goes through strict quality inspections and tests. Water Resistant Material: The material has an advanced IPX4 coating that prevents water from penetrating from any angle.The backpack features a 30L capacity and a padded laptop pocket that fits a 15.6 inch laptop. Additional necessities that can fit within are a lunchbox, charger, tablet, books, power bank, wallet, and sunglasses.",B0C2D4T9R5,‎Tabelito Trade India
https://www.amazon.in/Chic-Buddy-Waterproof-Swimsuits-Toiletries/dp/B0B25B5PB6/ref=sr_1_197?crid=2M096C6104MLT&keywords=bags&qid=1690126737&sprefix=ba%2Caps%2C283&sr=8-197,"Chic Buddy Waterproof Wet Bag, Washable, Reusable for Travel, Beach, Pool, Stroller, Diapers, Dirty Gym Clothes, Wet Swimsuits, Toiletries  ",299,4.4 out of 5 stars,380,"Care Instructions: Machine WashConvenient – Our wet bags are great for carrying diapers, dirty gym clothes and wet swimsuits; not just for wet stuff - these bags make excellent organizers for toys, accessories, toiletries, electronics, travel and moreReuse And Reduce Waste – The better alternative to single-use plastic bags, our bags are made of Chic Buddys' original waterproof fabric that’s both soft and strong (although fabric is waterproof, bags are not completely leakproof due to zippered closure)Waterproof – Chic Buddys’ original fabric is 100% polyester with embedded TPU for waterproofing and our heat-sealed seams keep the mess where it belongs - inside the bagLots Of Uses – Not just for wet stuff - these bags make excellent organizers for toys, accessories, toiletries, electronics, travel and more! With a snap handle, snap your bag wherever you need it - stroller, changing table or suitcaseEasy-To-Clean – Wipe small messes; hand-wash or machine wash; to extend the life of fabric, we do recommend hang drying our quick-dry fabric; always ensure fabric is completely dry before storing",TT-Z12-WETBAG,B0B25B5PB6
https://www.amazon.in/F-Gear-Blow-Laptop-Backpack/dp/B078J63VRY/ref=sr_1_198?crid=2M096C6104MLT&keywords=bags&qid=1690126737&sprefix=ba%2Caps%2C283&sr=8-198,"F Gear Blow Laptop Backpack With Rain Cover 32 Liters (Black,Grey) Sch Bag  ","1,099",4.3 out of 5 stars,"1,288","Care Instructions: Hand Wash OnlyWater Proof with attached Rain cover.Reflective Printing and in Built Laptop sleeve3 compartment, 1 pockets and 2 Bottle pouch.Comes with the F Gear promise of quality.Size(Hxlxw)Cm-(50x31x21)",Uber Fashion Merchandise Pvt. Ltd.,19 December 2017
https://www.amazon.in/Skybags-Unisex-Yellow-Fabric-Backpacks/dp/B0B21XM4KX/ref=sr_1_199?crid=2M096C6104MLT&keywords=bags&qid=1690126737&sprefix=ba%2Caps%2C283&sr=8-199,Skybags Unisex Gucci Fabric Backpacks  ,584,4.2 out of 5 stars,271,Care Instructions: Hand Wash OnlyA super sleek and casual 17L daypack. Ideal for college student or a day tour. Big enough to carry all your essentials. Sleek enough to carry it with ease,B0B21XM4KX,"VIP Industries Limited, DGP House, 88C, Old Prabhadevi Road, Prabhadevi, Mumbai 400025. India"
https://www.amazon.in/Half-Moon-Travelling-Rucksack-Compartment/dp/B09WDGZ32L/ref=sr_1_200?crid=2M096C6104MLT&keywords=bags&qid=1690126737&sprefix=ba%2Caps%2C283&sr=8-200,Half Moon 55 litres Travelling Laptop Bag/Rucksack Backpack for Luggage Travel Journey Trekking Hiking Bags for Men Women Boys and Girls with Laptop Compartment & Rain Cover  ,979,4.0 out of 5 stars,544,"ROOMY ENOUGH BACKPACK FOR MEN: This laptop bag for men is ultra lightweight comes with three main compartment having the capacity of approx 55 Ltr, big enough to carry laptop of all sizes, books, clothes, camping gear; 4 main compartments to store all your essentials and 1 small front pocket to carry small accessories. It also features an Internal Organiser(small pockets inside a office bag for men / office bag for women).COMFORT WITH QUALITY: This backpack for men has wide, padded and adjustable shoulder straps and padded back for comfort in carrying heavy items. The College Bags for men is stitched properly and Bartacks on every pressure point for extra durability. The backpack for men is made with strong yet light weight polyester fabric with heavy zippers. The laptop bag for men also comes with a Rain cover so that you can travel during rainy season without any problem.PROUDLY MADE IN INDIA: Half Moon laptop bag for men is proud to be an Indian Brand. We understand the importance of Indian manufacturing and supply chains. It is the time when we revive local industries that's why this college bags for men is Made in India by Indians using Indian materials.QUALITY OF BACKPACK FOR MEN: A major problem in many rucksack/office bag for men is that it get torn between your journey but this Rucksack is strong enough to hold even the heaviest of your items without any problem. It is made up of a strong polyester material, is stitched properly, and is bartacked on every pressure points for extra strength.OTHER FEATURES OF LAPTOP BAG FOR MEN: The office bag for men / office bag for women has Rain Cover, Internal Organiser(Small Pockets), Strong and durable zippers, Adjustable Shoulder Handles (Straps) , 2 Bottle/Umbrella holders , Padded Handle , Padded Laptop Compartment , Ergonomic Design, Reflector Logo, etc.",B09WDGZ32L,Half_Moon
https://www.amazon.in/Lenovo-Carrying-15-6-Inch-Toploader-GX40Q17230/dp/B075Y8294N/ref=sr_1_201?crid=2M096C6104MLT&keywords=bags&qid=1690126737&sprefix=ba%2Caps%2C283&sr=8-201,Lenovo 15.6-inch Casual Laptop Briefcase T210  ,979,4.3 out of 5 stars,"4,334","“COMPATIBLE WITH 15.6 INCH LAPTOP”: This organizer briefcase dimension fits up to 15.6 inch laptop. Dimensions: 40cm x 5.5cm x 30cm; Weight: 435g.“HIGH QUALITY, DURABLE AND WATER REPELLANT FABRIC”: This toploader features in durable snow yarn polyester fabric and streamlined design with a padded interior to protect notebooks and important items“INTEGRATED LUGGAGE STRAP FOR MORE CONVENIENT TRAVEL”:A fully adjustable shoulder straps make it comfortable for all-day use.“CONVENIENTLY PLACED PADDED LAPTOP COMPARTMENTS AND POCKETS: The padded interior helps protect notebooks and important items. Quick-access pocket ensure convenient access""HIGH QUALITY, CASUAL YET STYLISH DESIGN"": very attractive and perfect for college, school, travel and outdoor activities, daily commuters and all types of travelers who just looking for compact but stylish bag. Multiple colors for choiceWarranty NA“IN-THE-BOX”: 15.6-inch BriefcaseCountry of Origin: China","Lenovo, Ferns Icon, Level, 2, Outer Ring Rd, Doddanekundi, Mahadevapura, Bengaluru, Karnataka 560159",23 February 2018
https://www.amazon.in/TRUE-HUMAN-Anti-Theft-backpack-combination/dp/B09VCHV6T5/ref=sr_1_202?crid=2M096C6104MLT&keywords=bags&qid=1690126737&sprefix=ba%2Caps%2C283&sr=8-202,"TRUE HUMAN® Emperor Anti-Theft backpack with combination lock Laptop bag,office bag for Men and Women | College Bags for Girls & Boys (Zyden)  ",675,3.7 out of 5 stars,"1,172","» Superior & Durability: Made of durable and Eco-friendly water resistant oxford textile fabric,which keeps your files and stuffs dry inside. This backpack can hold up to 15.6"" laptop from most brands, but it may not be suitable for all brand 15.6"". Since there maybe exist slight size difference among different laptop brands.» PREMIUM MATERIAL: Made from high quality, waterproof Polyester material in grey color. Premium quality smooth zippers, pullers, buckles.",zyden-1,B09VCHV6T5
https://www.amazon.in/sspa/click?ie=UTF8&spc=MTozMzEyNDQxODQ1MjI5NjQ4OjE2OTAxMjY3Mzc6c3BfbXRmOjIwMDcyNTIzMDUzMDAyOjowOjo&url=%2FGear-Colorado-Orange-Laptop-Backpack%2Fdp%2FB097K6KD7W%2Fref%3Dsr_1_203_sspa%3Fcrid%3D2M096C6104MLT%26keywords%3Dbags%26qid%3D1690126737%26sprefix%3Dba%252Caps%252C283%26sr%3D8-203-spons%26sp_csd%3Dd2lkZ2V0TmFtZT1zcF9tdGY%26psc%3D1,F Gear Colorado Grey Orange 39 Ltrs Laptop Backpack (3814)  ,895,4.2 out of 5 stars,208,"2-main zippered compartment, one inside sleeve for laptop, a front pocket with an organizer.One zippered front pocket, one mesh zippered pocket & two mesh pockets on both sides.Thick padding anti-sweat breathable air mesh & adjustable padded shoulder straps.World’s best Japanese brand YKK zippers and sliders.Comes with the F Gear promise of quality and durability.",B097K6KD7W,Uber Fashion Merchandise Pvt Ltd
