Product URL,Product Name,Product Price,Rating,Number of Reviews,Description,ASIN,Manufacturer
https://www.amazon.in/sspa/click?ie=UTF8&spc=MTo1OTk2MDU2NzU3NTcwMDEwOjE2OTAxMjU1MDY6c3BfYXRmOjIwMDY1NTMzNjg0Njk4OjowOjo&url=%2FPOLICE-ltrs-cms-backpack-PTO020008_1_black%2Fdp%2FB0B81YTTWS%2Fref%3Dsr_1_1_sspa%3Fcrid%3D2M096C6104MLT%26keywords%3Dbags%26qid%3D1690125506%26sprefix%3Dba%252Caps%252C283%26sr%3D8-1-spons%26sp_csd%3Dd2lkZ2V0TmFtZT1zcF9hdGY%26psc%3D1,"uppercase Medium 23 Ltrs Tall Boy (14.6 inch) Laptop Backpack 2500EBP1 3x more water resistant sustainable bag with rain proof zippers for Men, Women, Boys and Girls, 750 Days warranty  ","1,700",4.0 out of 5 stars,248,"Care Instructions: Wipe with Damp ClothHandcrafted with care and made up of premium quality robust material, Wrinkle free bag and 3x more water resistant with Rainproof zippers",B0B81YTTWS,Acefour Accessories Pvt. Ltd.
https://www.amazon.in/sspa/click?ie=UTF8&spc=MTo1OTk2MDU2NzU3NTcwMDEwOjE2OTAxMjU1MDY6c3BfYXRmOjIwMTM0MDQ3OTE1ODk4OjowOjo&url=%2FIllusion-Skating-Resistant-Backpack-Computer%2Fdp%2FB09791Z64V%2Fref%3Dsr_1_2_sspa%3Fcrid%3D2M096C6104MLT%26keywords%3Dbags%26qid%3D1690125506%26sprefix%3Dba%252Caps%252C283%26sr%3D8-2-spons%26sp_csd%3Dd2lkZ2V0TmFtZT1zcF9hdGY%26psc%3D1,"jaspo Roller Skating Bag, Quad & Inline Skates (Water Resistant), Casual/Office/College Book Backpack Computer/Laptop Bag for Both Kids & Adults Travel Backpack  ",521,3.4 out of 5 stars,93,"★ Convenient & Safe: A Skating, inline, roller skates & casual, travel backpack is easier to carry anywhere. A customized padded fitting shoulder strap is more comfortable and relieves your shoulder. You can carry long period of time easily.★ Lightweight Backpack: Better padding nylon material is used to give maximum back support. Comfortable and proper ventilation in back side feels and relax your muscles. Adjustable and breathable shoulder straps relieve the stress of shoulders.★ Solid & Durable: This backpack is durable & water resistant with metal zippers. Secure & long usage and you can carry skating accessories daily or weekdays. Also look like professional backpack, easily to carry in school/college where you can easily stores books & other accessories. It is convenient for boys, girls, teens, adults, men’s or women’s.★ Multiple Pockets Available: Separate pocket is available for multipurpose fit 15.4 inches you can adjust lower dimension as well. One main pocket is also available for books/magazines/clothes/school/travel accessories. Mesh pocket at side easily to carry sipper or water bottles. Front Pocket is specially meant for store key, pen, pencil, cell phone.★ For Gift Purpose: You can also buy it for gifting purpose as well. You can give gift to your kids. 1 Bag please choose your bag accordingly.",B09791Z64V,"jaspo, jaspo industries ,11 new gautam nagar, kapurthala road, jalandhar"
https://www.amazon.in/American-Tourister-AMT-SCH-02/dp/B07CJCGM1M/ref=sr_1_3?crid=2M096C6104MLT&keywords=bags&qid=1690125506&sprefix=ba%2Caps%2C283&sr=8-3,American Tourister Fizz Large Size 32 Ltrs Casual Backpack (BLACK)  ,"1,199",4.0 out of 5 stars,"55,007","Laptop Compatibility: No, Strap Type: Adjustable, Trolley Support: No. With Rain Cover : NoOuter Material: Polyester, Color: BlackWater Resistance: Water resistant , not WaterproofCapacity: 32 liters; Dimensions: 31.5 x 22 x 49.5 CentimetersNumber of Wheels: 0, Number of compartments: 3Warranty type: Manufacturer; 1 year International warranty valid for 1 year from the original date ofMesh pockets on both sides to accommodate your sipper or bottle and umbrellaMesh Padding on back & shoulder strap to provide comfort & better back support",,
https://www.amazon.in/Wesley-Milestone-Waterproof-Backpack-Business/dp/B084JGJ8PF/ref=sr_1_4?crid=2M096C6104MLT&keywords=bags&qid=1690125506&sprefix=ba%2Caps%2C283&sr=8-4,Wesley Milestone 2.0 Casual Waterproof Laptop Backpack/Office Bag/School Bag/College Bag/Business Bag/Travel Backpack (Dimensions:13x18 inches) (Compatible with 39.62cm(15.6inch laptop) 30 L (Blue & black)  ,550,4.3 out of 5 stars,"11,841","30L Capacity: The Backpack has a padded laptop compartment that can fit 15.6 inch laptop. It can also accommodate essentials such as a Lunch box, Charger, Tablet, Books, Power Bank, Wallet, and Sunglass.Multi-Level Organizer: The backpack has a front zipper pocket for the ID card, Sanitizer, House keys, Pen. First compartment with pockets for the earphones, pens, notebook, Fitness Band. Spacious second compartment for all your electronics.Ergonomic Design: Thick cushioning around the shoulders and on the back panel makes the backpack super light and comfortable on the move. “S” Shaped shoulder strap distribute the weight of the backpack across your upper body.Made In India: Wesley Business Casual Backpack is fully manufactured in India and pass through stringent quality tests and checks1 Year Warranty: The Wesley Business casual backpack comes with 1 year of warrantyWater Resistant Material: Advanced IPX4 coating on the material ensures resistance to water entering from any direction.",,
https://www.amazon.in/Half-Moon-Backpack-Luggage-Compartment/dp/B09VCLZ3K4/ref=sr_1_5?crid=2M096C6104MLT&keywords=bags&qid=1690125506&sprefix=ba%2Caps%2C283&sr=8-5,Half Moon Large 37L Laptop Bag Backpack for menं Women Boys and Girls Luggage Travel Bags with 17.3 inches Laptop Compartment & Rain Cover  ,849,3.9 out of 5 stars,"3,224","This lightweight and spacious laptop bag with 3 compartments contains a dedicated 360 degree protected laptop compartment (up to 17""), so you can you can transport your tech with peace of mind. A Spacious second compartment for essentials like books and files, and a third compartment for extra items. Also features padded shoulder straps and side pockets for water bottles.Carry your books and belongings with ease with this comfortable and durable bagpack! Featuring wide, padded, and adjustable shoulder straps and a padded back, this backpack can handle even heavy loads. Made with strong yet lightweight polyester fabric and heavy-duty zippers, it's built to last. Plus, it comes with a rain cover, perfect for those rainy school or college days.Make a statement on your next trip with our smart and stylish backpack! With a trendy and athletic design, this multipurpose backpack is the perfect combination of style and adventure. Your trips, travel experience cannot get completed without this amazing trekking backpack.Experience enduring and long-lasting performance with our backpack! Made with highly durable material, this backpack is suitable for all weather conditions, including heavy rains and extreme heat. It not only keeps your belongings safe but also resists damage to itself. So, don't settle for anything less.FEATURES: Rain Cover, upto 17 inch Laptop compartment, Internal Organiser(Small Pockets), Strong and durable zippers, Adjustable Shoulder Handles (Straps) , 2 Bottle/Umbrella holders , Padded Handle , Padded Laptop Compartment , Ergonomic Design, Reflector Logo, etc",B09VCLZ3K4,Amazing Bags
https://aax-eu.amazon.in/x/c/RIXebB4z3KjPnlQlWMEtCzQAAAGJg1SYhwMAAAH2AQBvbm9fdHhuX2JpZDIgICBvbm9fdHhuX2ltcDEgICDVuwVa/https://www.amazon.in/Sirona-Sanitary-Napkin-Diapers-Disposal/dp/B01NAZVN8M/ref=sxin_15_sbv_search_btf?content-id=amzn1.sym.ea7f11f8-e26c-4b10-84ad-15aa33ea30ac%3Aamzn1.sym.ea7f11f8-e26c-4b10-84ad-15aa33ea30ac&crid=2M096C6104MLT&cv_ct_cx=bags&keywords=bags&pd_rd_i=B01NAZVN8M&pd_rd_r=59082db3-1827-4468-8957-beb55d21063f&pd_rd_w=iCUhY&pd_rd_wg=8izdD&pf_rd_p=ea7f11f8-e26c-4b10-84ad-15aa33ea30ac&pf_rd_r=2NXDWR6KE128CRXDCKK1&qid=1690125506&sbo=RZvfv%2F%2FHxDF%2BO5021pAnSA%3D%3D&sprefix=ba%2Caps%2C283&sr=1-1-9131241a-a358-4619-a7b8-0f5a65d91d81,"Sirona Sanitary Disposal Bags | 75 Bags | Pad Disposable Bags for Discreet Disposal of Tampons, Condoms, Diaper, Sanitary Pads, Panty Liner & Personal Hygiene Waste (Green)  ",211,4.5 out of 5 stars,"2,922","100% OXO-BIODEGRADABLE: The materials used to make these bags are 100% eco-friendly. They are oxo-biodegradable which means that they break down in the open environment like nature’s wastes but quicker and without leaving any toxic residues or plastic fragments behind.TEAR-RESISTANT: Sirona’s ‘I Love Clean’ Disposable Sanitary Bags are made using extra-durable plastic. It has thick double seams to hold your waste in- without ending up with rips and tears.SUPER-SEALED: The Sirona Sanitary Disposal Bags come with built-in glue which seals perfectly. The leak-proof design keeps the bacteria and wetness where it belongs making your surroundings safe and hygienic.MULTIPURPOSE: These oxo-biodegradable bags from Sirona are large enough for the hygienic and sanitary disposal of used feminine hygiene items, baby diapers, adult diapers, wet wipes and the disposable PeeBuddy.ODOUR-LOCK: Lock the smells of your waste in- just stick and seal to cancel out any unpleasant odours that have the possibility of emanating from these disposable bags. This is perfect for when you are travelling and can’t bin the waste.",First Step Digital Pvt Ltd,1 February 2017
https://www.amazon.in/Skybags-Brat-Black-Casual-Backpack/dp/B08Z1HHHTD/ref=sr_1_6?crid=2M096C6104MLT&keywords=bags&qid=1690125506&sprefix=ba%2Caps%2C283&sr=8-6,Skybags Brat Black 46 Cms Casual Backpack  ,669,4.1 out of 5 stars,"5,188","Care Instructions: Hand Wash OnlyCombination of functional & safety features in stylish design, Soft mesh back with 8 mm foam padded 2 Main Compartment, 1 Slip In Pocket inside the bag, Printed Design, Mesh bottle holder on the side,Water Resistance Level: Not Water ResistantSize: 35 x 13 x 46 cms",B08Z1HHHTD,VIP Industries Ltd
https://www.amazon.in/Gear-Classic-Leather-Backpack-LBPCLSLTH0201/dp/B07G4F6XFH/ref=sr_1_7?crid=2M096C6104MLT&keywords=bags&qid=1690125506&sprefix=ba%2Caps%2C283&sr=8-7,Gear Classic 20L Faux Leather Water Resistant Anti Theft Laptop Bag/Backpack for Men/Women (Brown)  ,987,4.4 out of 5 stars,"5,919","Care Instructions: Hand Wash OnlyOuter material: synthetic, color: brownWaterproofCapacity: 20 liters; Weight: 560 grams; Dimensions: 48 cms x 32 cms x 14 cms (LxWxH)Number of compartments: 2Laptop compatibility: yes, laptop size: 16strap type: adjustableAnti theft waterproof bag with anti sweat fabric on back and shoulder straps",B07G4F6XFH,Gear Merchandise PVT LTD
https://www.amazon.in/Half-Moon-Waterproof-Backpack-Students/dp/B085MHDJ93/ref=sr_1_8?crid=2M096C6104MLT&keywords=bags&qid=1690125506&sprefix=ba%2Caps%2C283&sr=8-8,"Half Moon 35 Ltrs Water Resistant 15.6 inch Laptop Bag for Men/Backpack for Men, Navy Blue | Office Bag for Men/Office Bag for Women with Padded Laptop Compartment | Rain Cover & Reflective Strips  ",649,3.9 out of 5 stars,"16,585","Care Instructions: Hand Wash OnlySPACIOUS AND LIGHTWEIGHT: Light weight & spacious laptop bag for men comes with 3 compartments. One is for carrying laptop inside (Upto 17""), with padding for safety, and space for laptop accessories like charger, etc. Second compartment of office bag for men is for books, files & all your day to day essentials. And third compartment of backpack for men is for your extra stuff. Laptop backpacks for men has provision for holding bottles on both sides & has padded shoulder straps for your comfortCOMFORT WITH QUALITY: This backpack for men has Wide, Padded & Adjustable shoulder straps & Padded Back for comfort in carrying heavy items. The laptop bag for men is stitched properly & Bartacks on every pressure point for extra durability. The office bag for men are made with strong yet light weight polyester fabric with heavy zippers. College Bags for men also comes with a Rain cover so that you can travel during rainy season without any problem. This laptop bag can be used by everyone.SMART & TRENDY LOOKS: This Large backpack for men is smart, trendy and stylish in looks. The multipurpose college bags for men looks smart, athletic and venturesome and the blend of grey and red makes it appear exquisite. Your hiking trips, mountaineering experience cannot get completed without this amazing trekking backpack. PREMIUM FABRIC : Premium Polyester, Stylish and durable backpack for school /college and travel. Easily accommodate a laptop. Size: 45 cm X 31 cm X 22 cmENDURING & LONG LASTING LAPTOP BACKPACK: This trekking backpack for men/laptop bag for men is made up of highly durable material, which makes it suitable for all weather conditions including rains & extreme scorching heat. It will not only keep the inside stuff safe but will also resist damage to itself. We have designed the bag keeping your comfort in mind. Shoulder has high density padding, with 3D ventilated air foam padding to prevent sweating & to help you lift heavy objects easily.OTHER FEATURES OF LAPTOP BAG FOR MEN: The office bag for men / office bag for women has Strong and durable zippers, Adjustable Shoulder Handles (Straps) , 2 Bottle/Umbrella holders , Padded Handle , Padded Laptop Compartment (can carry laptops of size 13, 14, 15.6 & 17 inches), Reflector Logo.",B085MHDJ93,Amazing Bags
https://www.amazon.in/NORTH-ZONE-Waterproof-Backpack-Dimensions/dp/B0BS6QQZYN/ref=sr_1_9?crid=2M096C6104MLT&keywords=bags&qid=1690125506&sprefix=ba%2Caps%2C283&sr=8-9,NORTH ZONE Casual Waterproof Laptop Backpack/Office Bag/School Bag/College Bag/Business Bag/Travel Backpack (Dimensions:13x18 inches) (Compatible with 39.62cm(15.6inch laptop) 30 L  ,630,4.0 out of 5 stars,476,"Care Instructions: Machine WashSleek, Stylish and Premium: Heavy duty ultra premium bag with exterior dimensions 44x29x15 cms. Made of Durable Polyester Fabric with Double zippers. sturdy durable, scratch resistant.; Multi Utility Bag: It is not only a student backpack, but also can be used as a business/work backpack, travelling, office, computer bag, hiking bag, daily bag and a lot more.Storage Space: There is a separate laptop compartment inside the backpack that can hold upto 15.6 inches laptop. The internal packaging compartment and external pockets can hold daily necessities, keeping your items organized and easier to find.Quick Storage: The front and side zipper pockets of the backpack are convenient for storing tablets, diaries, pens and pencils, smartphones, cards, change, etc. The side pockets of the backpack are convenient for storing compact umbrellas and other small items.",B0BS6QQZYN,SHABA BAGS
https://www.amazon.in/TRUE-HUMAN-Anti-Theft-backpack-charging/dp/B09QJ7ZF2Y/ref=sr_1_10?crid=2M096C6104MLT&keywords=bags&qid=1690125506&sprefix=ba%2Caps%2C283&sr=8-10,"TRUE HUMAN Emperor Anti-Theft backpack With USB charging Port Laptop Bag, Office bag, college bag and anti -theft back pocket (Black)  ",689,3.8 out of 5 stars,"2,313","Care Instructions: Hand Wash OnlyEase of Access-Multi purpose pockets Super sorted stuff It has a vibrant and stylish design, along with the added benefit of spacious interiors.Anti - Theft Pocket-Hidden storage pocket for important documents like passports, tickets, cash while on the go.Integrated Fast charging port-Unique pre-fitted USB port helps you to easily connect your phone or any other device with your power bank. Charging system for smart devices , with free USB (power bank not included )Care Instructions: Wipe with Dry ClothSuperior & Durability: Made of durable and Eco-friendly water resistant oxford textile fabric,which keeps your files and stuffs dry inside. This backpack can hold up to 15.6"" laptop from most brands, but it may not be suitable for all brand 15.6"". Since there maybe exist slight size difference among different laptop brands.",LEGEND-1,B09QJ7ZF2Y
https://www.amazon.in/sspa/click?ie=UTF8&spc=MTo1OTk2MDU2NzU3NTcwMDEwOjE2OTAxMjU1MDY6c3BfbXRmOjMwMDAxMzM0Mjk4MzgzMjo6MDo6&url=%2FPolice-Polyester-laptop-casual-backpack%2Fdp%2FB09CQ5T3LN%2Fref%3Dsr_1_11_sspa%3Fcrid%3D2M096C6104MLT%26keywords%3Dbags%26qid%3D1690125506%26sprefix%3Dba%252Caps%252C283%26sr%3D8-11-spons%26sp_csd%3Dd2lkZ2V0TmFtZT1zcF9tdGY%26psc%3D1,POLICE Backpack for Men Casual Laptop Bag Office/Travel/College 30 Ltr Hedge Polyester - Black  ,"1,399",4.1 out of 5 stars,"5,733",Care Instructions: Hand Wash OnlyBackpack,Backpack,B09CQ5T3LN
https://www.amazon.in/sspa/click?ie=UTF8&spc=MTo1OTk2MDU2NzU3NTcwMDEwOjE2OTAxMjU1MDY6c3BfbXRmOjIwMTY3MTU0OTgxMjk4OjowOjo&url=%2FEUME-Tourismo-Backpack-Resistance-15-6-inch%2Fdp%2FB0B4JQSMD5%2Fref%3Dsr_1_12_sspa%3Fcrid%3D2M096C6104MLT%26keywords%3Dbags%26qid%3D1690125506%26sprefix%3Dba%252Caps%252C283%26sr%3D8-12-spons%26sp_csd%3Dd2lkZ2V0TmFtZT1zcF9tdGY%26psc%3D1,EUME Tourismo 36L Laptop Backpack Bag with 2 Large Compartment for Work Office & Business Travel for Men & Women | Water Resistance | Fit Up to 16 Inch Laptop  ,"2,499",4.4 out of 5 stars,7,"2 Large Compartments 1 Easy access front Pocket with organizer section & 2 mesh side pocketCapacity : 36 L ; Dimensions : 13X9X19 Inch (LXWXH)Pretty much everything on this backpack is heavily padded. The laptop compartment is also super protective, so there's no need to worry about your laptop getting all banged and damaged. These bags are made of long lasting fabric and their stylish designs help you to make the best impression. It's features are such to make sure that every day is bright and organized.Laptop pocket designed for your laptops to give them maximum security. It comes with Ipad Pocket and Pen Pocket which aids in organising your things systematically. A comfortable breathable back and straps to strengthen your shoulder and hence ensures durability.A roller bag sleeve added feature to make your travelling even more comfortable and convenient. It is water resistance also so that your backpack never loses its good look.",B0B4JQSMD5,EUME Lifetsyle Pvt Ltd
https://www.amazon.in/Gear-Black-Laptop-Backpack-LBPASPIRE0104/dp/B075MK4TXP/ref=sr_1_13?crid=2M096C6104MLT&keywords=bags&qid=1690125506&sprefix=ba%2Caps%2C283&sr=8-13,Gear Cello 30 Ltrs Black Laptop Backpack (LBPASPIRE0104)  ,"1,125",4.4 out of 5 stars,"5,912","Outer Material: Polyester, Color: BlackWater Resistance: Water resistantCapacity: 30 liters; Dimensions: 50 cms x 34 cms x 18 cms (LxWxH); Number of compartments: 2Laptop Compatibility: Yes, Laptop Size: 17, Strap Type: Adjustable,Closure Type: Zipper; Pocket Description: Utility Pocket; Special Features: Laptop Compartment; Age Range Description: Adult; Style Name: Traditional Backpacks",B075MK4TXP,Gear Merchandise PVT LTD
https://www.amazon.in/Nelle-Harper-Womens-Sling-Green/dp/B07JGQM7DC/ref=sr_1_14?crid=2M096C6104MLT&keywords=bags&qid=1690125506&sprefix=ba%2Caps%2C283&sr=8-14,Nelle Harper Women's Handbag  ,809,3.7 out of 5 stars,"1,905","Style meets functionality with this well crafted sling along with attractive gold hardware giving it a classy vintage lookThe inner magnetic closure compartments, and zipper pockets converts the bag into your efficiency partner for your A-gameClub it with your evening dress or sling it along for that satisfying shopping spreeMade in India",B07JGQM7DC,Red Turks India
https://www.amazon.in/Wesley-Spartan-Hiking-Raincover-Organiser/dp/B098QFF5TJ/ref=sr_1_15?crid=2M096C6104MLT&keywords=bags&qid=1690125506&sprefix=ba%2Caps%2C283&sr=8-15,Wesley Spartan Unisex Travel Hiking Laptop Bag fits Upto 17.3 inch with Raincover and Internal Organiser Backpack Rucksack College Bag  ,749,4.1 out of 5 stars,"1,556","Care Instructions: Hand Wash OnlySpacious : This Rucksack bag is lightweight and comes with Three main compartment having the capacity of approx 45 Ltr, big enough to carry laptop of all sizes, books, clothes, camping gear; 3 main compartments to store all your essentials, A back mesh pocket to carry extra documents and numerous small pocket to carry all your small accessoriesCAPACITY & SIZE : 45 Litres; Weight: 0.9 kg ; Dimensions: 22.9cm x 36.8cm x 50.8cm ; Utility : Ideal for Travel, Hiking, Trekking & Camping, Day trip.; HIGH QUALITY : A major problem in many rucksack and travelling bags is that it get torn between your journeys or within a short period of time but this Rucksack which is made from high Quality materials, is stitched properly and has bartacks on pressure points is strong enough to hold all your items without any problemFEATURES : Back Padding, Chest Strap, Earphone Cord Support, Unique Design, Hip Belt, Integrated Rain Cover, Laptop Compartment, Telescope Handle, Water Bottle / Umbrella Pouch, Zip Closure, Padded Handles, Padded Shoulder Strap , Breathable Mesh etc.; Closure Type: Zipper; Age Range Description: AdultCOMFORTABLE TRAVEL : Backside Honeycomb padded structure which helps you travelling comfortably all day long, provides proper air circulation while in summer also to prevent you feel more relax. Chest Strap, Hip Belt, Straight Shaped Straps structure which fits on your shoulders very comfortably makes you lift heavy objects easily.12 Months Limited Brand Warranty",B098QFF5TJ,Wesley
https://www.amazon.in/Lunars-Bingo-Laptop-Resistant-48L/dp/B08YZ8FFBZ/ref=sr_1_16?crid=2M096C6104MLT&keywords=bags&qid=1690125506&sprefix=ba%2Caps%2C283&sr=8-16,Lunar's Bingo - 48 L Laptop Office/School/Travel/Business Backpack Water Resistant - Fits Up to 15.6 Inch Laptop Notebook with 1 Year Warranty  ,899,3.9 out of 5 stars,"9,897","MADE IN INDIA - This “MAKE IN INDIA” Laptop bag for men features 3 large zippered compartments, 1 zip pocket at front, 2 side bottle pockets. This is a perfect laptop, office, school, college bag for men, women, boys and girls. In deed a perfect all-rounder backpack for men, school bags for boys and girls, College bag for boys and college bag for girls, office bag for men and women.LAPTOP BAG FEATURES - Compartment Description: Up To 15 Inches; Style Name: Casual Backpack for men. Capacity: 48 liters. Size: 20 inch X 13.5 inch X 9.5 inch.WATER RESISTANT – This laptop bag for men is stylish and durable unisex travel laptop backpack that is your perfect travel partner. School bags for boys is made of high-grade water-resistant polyester material that gives it strength and durable for long-term use. 12 months warranty for any manufacturing defects.PADDED LAPTOP SLEEVE AND INTERNAL ORGANISER : Padded Laptop backpack for men has sleeve with holder to secure upto 15.6"" Laptops. This office bag for men is compatible with laptops like HP / Lenovo / Acer / ASUS / Dell. Internal organiser to neatly organise and store your keys, cables, stationary and other valuables from theft.1 YEAR WARRANTY - We offer 1 Year warranty for any manufacturing defects; BEST BACK SUPPORT - We have designed this laptop bag for men to keep your comfort in mind. Shoulder has 12MM high density padding, with 3D ventilated air foam padding to prevent sweating when you use the bag; Pattern Name: Solid; Age Range Description: Adult; Color Name: Black; Special Features: Laptop Compartment; Pattern Name: Solid; Age Range Description: Adult",B08YZ8FFBZ,"Akshaya Rubbers, Hebbal Industrial Area, Mysore"
https://www.amazon.in/SFANE-Duffel-Shoulder-Women-Compartment/dp/B07XXFB9CZ/ref=sr_1_17?crid=2M096C6104MLT&keywords=bags&qid=1690125506&sprefix=ba%2Caps%2C283&sr=8-17,Sfane Polyester 23cms Duffle/Shoulder/Gym Bag for Men & Women with Separate Shoe Compartment (Grey)  ,427,4.3 out of 5 stars,"7,630","Premium Durable Material - Travel duffel bag is made of high quality,durable material.Separate Shoes Compartment - Built-in extra shoes compartment with exterior zippers to keep your shoes and clean sport gears separate.Multi-Purpose & Any Occasions - Perfect Duffle Bag for hiking, family holiday, vacation, sports, a short trip, gym, work, beach, used as a overnight bag, a short journey bag, a weekender bag, gym bag, sports duffel bag.Adjustable Shoulder straps - Comfortable and adjustable shoulder strapAbundance of Storage - Large capacity,meet your requirement for sure and keep your stuff in order. What an amazing design for Sport Bag!",Sfane,11 September 2019
https://www.amazon.in/SAFARI-Ltrs-Casual-Backpack-DAYPACKNEO15CBSEB/dp/B07Q7CNPMV/ref=sr_1_18?crid=2M096C6104MLT&keywords=bags&qid=1690125506&sprefix=ba%2Caps%2C283&sr=8-18,Safari Compact Size 15 Ltrs Casual Backpack For Unisex Adult - Sea Blue  ,248,4.0 out of 5 stars,"20,013","Care Instructions: Hand Wash OnlyOuter Material: Polyester, Color: Sea BlueNot water resistant. With Rain Cover:NoCapacity: 15 liters; Weight: 200 grams; Dimensions: 12 cms x 27 cms x 41 cms (LxWxH)Number of compartments: 2; Laptop Compatibility: NoAge Range Description: Kid; Closure Type: Drawstring; Pocket Description: Utility PocketDrawstring, 2 Compartments, Compact Size",B07Q7CNPMV,Safari Industries (India) Ltd
https://www.amazon.in/NORTH-ZONE-Lightweight-Backpacks-Stylish/dp/B0BL3TVDK6/ref=sr_1_19?crid=2M096C6104MLT&keywords=bags&qid=1690125506&sprefix=ba%2Caps%2C283&sr=8-19,Northzone Lightweight school bags Backpacks for Boys Girls Stylish men and women Casual Travel Laptop Bag College office (Black) 40L  ,549,4.0 out of 5 stars,122,"Care Instructions: Hand Wash OnlyCOMPATIBLE WITH 15.6 INCH LAPTOP”: The Northzone Backpack fits up to 15.6 inch laptop. Dimensions: 34cm x 15cm x 45.5cm; Weight: 499gHIGH QUALITY, DURABLE AND WATER REPELLANT FABRIC”: This backpack features in durable snow yarn polyester fabric and streamlined design with a padded interior to protect notebooks and important itemsCONVENIENT TRAVEL"" Adjustable shoulder strap and padded laptop compartment together with a quilted back panel make it comfortable for all-day useCONVENIENTLY PLACED PADDED LAPTOP COMPARTMENTS AND POCKETS: The padded interior helps protect notebooks and important items. Quick access zippered front pocket for added storage. A quilted back panel make it comfortable for all-day use.HIGH QUALITY, CASUAL YET STYLISH DESIGN"": very attractive and perfect for school, travel and outdoor activities. The perfect backpack for those needing stylish all-day protection for their laptop.",B0BL3TVDK6,Northzone
