Product URL,Product Name,Product Price,Rating,Number of Reviews,Description,ASIN,Manufacturer
https://www.amazon.in/Genie-compartments-Lightweight-Travelling-Purpose-36/dp/B097JHSJTL/ref=sr_1_95?crid=2M096C6104MLT&keywords=bags&qid=1690126048&sprefix=ba%2Caps%2C283&sr=8-95,"Genie Lily Laptop Backpack for Women, 3 compartments, Stylish and Trendy College Bags for Girls, Water Resistant and Lightweight Bags for Office and Travelling Purpose.36 litres (19 inch) Black colour  ",899,5.0 out of 5 stars,1,"Made with High Quality fabric. Outer material: Nylon Twill - Soft, Durable and Water Resistant. Capacity: 36 liters, Weight: 596 g, Dimensions: 48 x 33 x 23 cm Warranty: 12 months3 Spacious compartment: Store your Books, Stationary, Accessories, Lunch boxes, etc. It will store plenty of items. Laptop Sleeve: Ensure that your laptop is stored separately and Securely! Organizer: Keep every single item separately in an arranged manner, with the help of our organizer. 1 side pocket: For holding water bottle, clipping pens or pencil or storing other items. 1 Front Pocket: Easily accessible. To keep all your essentials such as wallet, ticket, cosmetics.Easy grab padded handle: For added comfort and convinience to hold the bag. Padded and Ergonomic Shoulder Straps: There is padded back mesh and ergonomic straps that gives extra spine and shoulder support and helps in minimizing the load after carrying the bag through a busy day at campus.This women's backpack can be carried to work, college, school, for a day out or even while you are travelling!Light Weight yet Durable to resist the weight of textbooks, stationary, lunch boxes. Can store all your college or office stationary, without any hassle.Stylish & Cute: This bag is designed for those Millennials and GenZ, who do not want to compromise on Utility or Fashion! It is a perfect, small bag to carry all the daily essentials while using it as a trendy accessory, or a travel bag or as a college backpack.",B097JHSJTL,Safari
https://www.amazon.in/Trends-Light-Weight-Unisex-Sling/dp/B07MX7PFQT/ref=sr_1_96?crid=2M096C6104MLT&keywords=bags&qid=1690126048&sprefix=ba%2Caps%2C283&sr=8-96,TRENDS Unisex Sling Bag (Sea Green)  ,299,4.0 out of 5 stars,366,"Versatile and Convenient: Our sling bag is the perfect accessory for people who are always on the go. Its compact size and crossbody design make it easy to carry around and access your essentials quickly.Stylish and Trendy: With its sleek and modern design, our sling bag is the perfect addition to any outfit. Whether you're running errands, heading to work, or going out with friends, our bag will make sure you look great while staying organized.Durable and High-Quality: Made from high-quality materials, our sling bag is built to last. It's designed to withstand wear and tear, making it the perfect choice for people who need a reliable bag that can keep up with their active lifestyle.Secure and Safe: Our sling bag features multiple compartments and pockets, including a secure zippered main compartment to keep your valuables safe and organized. You can carry your phone, wallet, keys, and other essentials with confidence.Comfortable and Adjustable: Our sling bag is designed with your comfort in mind. It features an adjustable strap that you can customize to fit your body perfectly, reducing strain on your shoulders and back.Ideal for Travel: Whether you're heading on a day trip or a weekend adventure, our sling bag is the perfect travel companion. It's lightweight and easy to carry, and its multiple compartments make it easy to organize your essentials.Great Gift Idea: Our sling bag makes a great gift for anyone who needs a stylish and functional bag. It's perfect for students, travelers, commuters, and anyone who wants to stay organized on the go.",B07MX7PFQT,Selvi
https://www.amazon.in/ZAINTO-Textured-Leatherette-Stylish-Travelling/dp/B09CTY23YG/ref=sr_1_97?crid=2M096C6104MLT&keywords=bags&qid=1690126048&sprefix=ba%2Caps%2C283&sr=8-97,ZAINTO Unisex Textured Leatherette Stylish 35 Liter Cabin Bags for Travelling in Flight 7kg Latest Travel Textured Leather Duffle Bags for Men and Women (Brown)  ,799,4.2 out of 5 stars,858,"?HIGH-QUALITY MATERIALS-This duffel bag is made of top-quality Textured Leatherette , thickened leather . And the leather material won't rip or tear when you put a lot of items in this carry-on duffle bag which is Durable, Long Lasting and tested to ensure they don't peel off in just a few months. The leather is also water resistant. Inner fabric lining ensured to have a soft touch feel. We use quality zips and accessories that have a long life.<br>?BETTER PRACTICALITY-The leather travel duffel bag has a zippered pocket on the front, which can conveniently store mobile phones, passports, wallets and other items. and the adjustable shoulder strap has a comfortable cushion that can be carried on the body.;Handle Type: Web Handle<br>?OVERSIZED BUSINESS BAG-47 x 28 x 27 CM. Volume Capacity - 35 Litres. Huge Spacious Compartment Large oversized capacity Larger than normal gym duffel bag, suitable for 3-4 days weekender or business trip. Unisex classic style perfect for men and women.<br>?STYLISH DESIGN- This stylish yet utilitarian textured leatherette duffle bag can be used for corporate travel as well as to take to the gym. The Large Spacious Compartment is suitable to be used as a carry-on flight bag 7kg as well. carry-on luggage bag for men and women bags.<br>?SATISFACTION GUARANTEED Your happiness is our number one priority here at ZAINTO Each of our products is handmade with the utmost care and built to last. All of our bags and accessories are designed in India and our all products are made in India. At ZAINTO we offer 10 days No Question asked replacement guarantee from the date of delivery. 24 Months Manufacturer and Seller Warranty against Manufacturing Defects.<br>",ZD001_Brown,B09CTY23YG
https://www.amazon.in/SPENZ-BAGS-Backpack-Raincover-Baby-Pink/dp/B0C3RNFHHV/ref=sr_1_98?crid=2M096C6104MLT&keywords=bags&qid=1690126048&sprefix=ba%2Caps%2C283&sr=8-98,"SPENZ BAGS Travel Laptop Backpack for Women & Men|Carry On Bag, College & School Students Bookbag With Raincover  ",999,4.2 out of 5 stars,120,"Care Instructions: Hand Wash OnlyLARGE CAPACITY & MANY POCKETS: This backpack has two main compartment pockets. One separate laptop compartment holds 15.6 Inch Laptop as well as 15 Inch, 14 Inch and 13 Inch Mac book or Laptop. The other one packing compartment is roomy for daily necessities and tech electronics accessories. Front compartment with zipper pocket and 2 elastic mesh side pockets.Make your items organized and easier to find.COMFY & BREATHABLE BACKPACK: Adjustable shoulder straps and back side comes with comfortable and breathable mesh design, relieves the stress of your shoulder. A comfortable airflow foam-pad back design with soft, multi-panel breathable mesh padding, offer your back maximum back support. A foam-padded top handle for a long time carry on.HIGH QUALITY MATERIAL: Our backpack made of waterproof and quality Polyester fabric with metal zippers. Lightweight and sturdy, ensure a secure & long-lasting usage every day. Perfects for weekend getaways, shopping, office work, business traveling and other outdoor activities. Also, it is a perfect student’s backpack for women, men, teens, boys and girls.LAPTOP PROTECTION: Separate laptop compartment with foam padded of this back pack offers the optimal protection for your 15.6 inch laptop. Mesh pockets for mouse, adapter, charging cord and other electronics. Take the worry out of your work and study.IDEAL GIFT: This fashionable backpack can be a great companion for travel, business, everyday use and outdoor activities. Also, a perfect college high school student backpack for boys, girls, teens. Practical gifts for teens, boys, girls, friends, mother, father, her or him.",B0C3RNFHHV,Spenz Bags
https://www.amazon.in/Wildcraft-Packs18-Laptop-Backpack-Streak/dp/B07FC4D9B5/ref=sr_1_99?crid=2M096C6104MLT&keywords=bags&qid=1690126048&sprefix=ba%2Caps%2C283&sr=8-99,Wildcraft Work Packs'18 21 Ltrs Black Laptop Backpack (Streak Plus)  ,"1,374",4.4 out of 5 stars,"1,977","Outer Material: Fabric, Color: Black; Water resistantCapacity: 21 liters; Weight: 480 grams; Dimensions: 18 inches x 13 inches x 5 inches (LxWxH)Number of compartments: 2Laptop Compatibility: Yes, Laptop Size: 15 inchesPocket Description: Utility Pocket; Closure Type: Zipper; Age Range Description: Adult; Style Name: Traditional Backpacks; Special Features: Laptop Compartment; Lining Description: NylonFits upto 15"",Side mesh pocket for water bottle",Wildcraft,7 July 2018
https://www.amazon.in/TRUE-HUMAN-Anti-Theft-charging-combination/dp/B09H7PK5ML/ref=sr_1_100?crid=2M096C6104MLT&keywords=bags&qid=1690126048&sprefix=ba%2Caps%2C283&sr=8-100,TRUE HUMAN Anti-Theft and USB charging port backpack with security lock Laptop bag|office bag| for men and women (Grey)  ,649,3.8 out of 5 stars,"1,854","Care Instructions: Hand Wash OnlyCare Instructions: Wipe with Damp ClothThis business laptop backpack design with separate laptop compartment to hold 15.6 Inch Laptop as well as 15 Inch,14 Inch and 13 Inch Macbook/Laptop. 2 spacious packing compartments roomy for iPad,mouse,charger,binders,books,clothes,ect. Front compartment with many pockets, pen pockets and key fob hook, make your items organized and easier to find.Night Vision Reflective Design: night vision reflective material in the front of the bag,it would be noticed easily while you are running or bicycling at night, keeping you safe.USB PORT-With outside USB charger and inside charging cable ,this usb backpack offers you a more convenient way to charge your phone/electronic device while walking. Please kindly noted that usb charging port only offers an easy access to charge, this backpack do not provide power itself.Superior Material&Solid: Made with durable, Water resistant Polyester to withstand harsh conditions and easy to clea makes this backpack simple but look stylish. Perfect for college school, business trips, hiking, camping, office work and everyday use.",B09H7PK5ML,1
https://www.amazon.in/sspa/click?ie=UTF8&spc=MToyOTE3MTg4MTMwNzAzMTE0OjE2OTAxMjYwNDg6c3BfYnRmOjIwMTI1ODk5OTIwNjk4OjowOjo&url=%2Fuppercase-Professional-Backpack-resistant-sustainable%2Fdp%2FB0BWNBQXDZ%2Fref%3Dsr_1_101_sspa%3Fcrid%3D2M096C6104MLT%26keywords%3Dbags%26qid%3D1690126048%26sprefix%3Dba%252Caps%252C283%26sr%3D8-101-spons%26sp_csd%3Dd2lkZ2V0TmFtZT1zcF9idGY%26psc%3D1,"uppercase Apex Professional Laptop Backpack (15.6 Inch) 3x more water resistant sustainable bags with rain proof zippers for Men, Women, Boys and Girls, 750 Days warranty  ","1,800",4.3 out of 5 stars,66,"Care Instructions: Wipe with Damp ClothHandcrafted with care and made up of premium quality robust materialPadded laptop compartment fits up to 15.6"" Laptop, Back padding with Air mesh; Front access pocket for you to easily carry important small items with a bottle holder on the sideWrinkle free bag and 3x more water resistant with Rainproof zippers; Trolley sleeve to securely place the bags on the luggage; Top Slip In PocketGRS certified for sustainability; The GRS (Global Recycled Standard) is intended for use with any product that contains at least 50% Recycled Material (License No. CMPY-158596); 750 days of international warranty",B0BWNBQXDZ,Acefour Accessories Pvt. Ltd.
https://www.amazon.in/sspa/click?ie=UTF8&spc=MToyOTE3MTg4MTMwNzAzMTE0OjE2OTAxMjYwNDg6c3BfYnRmOjMwMDAxNDU5NDAwMTYzMjo6MDo6&url=%2FElegant-Leatherette-Waterproof-Backpack-Business%2Fdp%2FB0C4GVK22X%2Fref%3Dsr_1_102_sspa%3Fcrid%3D2M096C6104MLT%26keywords%3Dbags%26qid%3D1690126048%26sprefix%3Dba%252Caps%252C283%26sr%3D8-102-spons%26sp_csd%3Dd2lkZ2V0TmFtZT1zcF9idGY%26psc%3D1,Elegant 16 inch 28 L Casual Waterproof Laptop Backpack/Office Bag/School Bag/College Bag/Business Bag/Unisex Travel Backpack  ,799,5.0 out of 5 stars,5,Dimensions and Capacity]: (48 Cm X 33 Cm X 28 CM) 28 Liters. Compatible upto 16 Inches Laptop.Easy Access Pockets: A sleek anti-theft pocket on the back as well as 2 pockets on the front side help keep all your belongings comfortably organized.Two Large Compartment: It comes with two large compartments with separate padded laptop compartment with elastic bands to hold the laptop.Ergonomic Design: The backpack features a sleek and ergonomic design with a balanced weight distribution through its straps to reduce the load bearing on your shoulders while the padded ventilated air mesh helps reduce sweat. This makes this backpack a suitable alternative to bulky and unsightly laptop backpacksWaterproof Fabric: The backpack comes with a superior waterproof fabric which helps in keeping your laptop and other important stuff safe from rain,BLCK-Black,B0C4GVK22X
https://aax-eu.amazon.in/x/c/RI8u6sp8etVo9DZH1-2abkQAAAGJg1zbRQMAAAH2AQBvbm9fdHhuX2JpZDMgICBvbm9fdHhuX2ltcDEgICAQzA1i/https://www.amazon.in/uppercase-Professional-resistant-sustainable-Anti-theft/dp/B0BR179L65/ref=sxbs_sbv_search_btf?content-id=amzn1.sym.880c6186-3832-495e-9caa-7ecfb2f5e88c%3Aamzn1.sym.880c6186-3832-495e-9caa-7ecfb2f5e88c&crid=2M096C6104MLT&cv_ct_cx=bags&keywords=bags&pd_rd_i=B0BR179L65&pd_rd_r=eb6ccb21-36cf-4cff-9083-5f8bbe1112bd&pd_rd_w=Idr21&pd_rd_wg=kabfK&pf_rd_p=880c6186-3832-495e-9caa-7ecfb2f5e88c&pf_rd_r=TBYH6DXBTGTKA5BZ1YCC&qid=1690126048&sbo=EO%2BcdOgoisx3waG5xqcZQA%3D%3D&sprefix=ba%2Caps%2C283&sr=1-81-06195d41-65bd-48f4-8e70-03d97b6094ec,"uppercase SealPro Professional Laptop Backpack (15.6 Inch) 3x more water resistant sustainable bags with rain proof zippers & Anti-theft for Men, Women, Boys and Girls, 750 Days warranty  ","1,900",4.6 out of 5 stars,69,"Care Instructions: Wipe with Damp ClothHandcrafted with care and made up of premium quality robust materialPadded anti-theft laptop compartment fits up to 15.6"" Laptop, Back padding with Air mesh; Pocket under flap and 2 mesh pocket inside main compartment with a bottle holder on the sideWrinkle free bag and 3x more water resistant with Rainproof zippers; Trolley sleeve to securely place the bags on the luggage; Top Slip In PocketGRS certified for sustainability; The GRS (Global Recycled Standard) is intended for use with any product that contains at least 50% Recycled Material (License No. CMPY-158596); 750 days of international warranty",B0BR179L65,Acefour Accessories Pvt. Ltd.
https://www.amazon.in/sspa/click?ie=UTF8&spc=MToxMzMxMjMzODUyMTk3OTI0OjE2OTAxMjYxNTE6c3BfYXRmX25leHQ6MzAwMDEzMzQyOTgzODMyOjowOjo&url=%2FPolice-Polyester-laptop-casual-backpack%2Fdp%2FB09CQ5T3LN%2Fref%3Dsr_1_97_sspa%3Fcrid%3D2M096C6104MLT%26keywords%3Dbags%26qid%3D1690126151%26sprefix%3Dba%252Caps%252C283%26sr%3D8-97-spons%26sp_csd%3Dd2lkZ2V0TmFtZT1zcF9hdGZfbmV4dA%26psc%3D1,POLICE Backpack for Men Casual Laptop Bag Office/Travel/College 30 Ltr Hedge Polyester - Black  ,"1,399",4.1 out of 5 stars,"5,733",Care Instructions: Hand Wash OnlyBackpack,Backpack,B09CQ5T3LN
https://www.amazon.in/sspa/click?ie=UTF8&spc=MToxMzMxMjMzODUyMTk3OTI0OjE2OTAxMjYxNTE6c3BfYXRmX25leHQ6MjAxNjcxNTQ5ODEyOTg6OjA6Og&url=%2FEUME-Tourismo-Backpack-Resistance-15-6-inch%2Fdp%2FB0B4JQSMD5%2Fref%3Dsr_1_98_sspa%3Fcrid%3D2M096C6104MLT%26keywords%3Dbags%26qid%3D1690126151%26sprefix%3Dba%252Caps%252C283%26sr%3D8-98-spons%26sp_csd%3Dd2lkZ2V0TmFtZT1zcF9hdGZfbmV4dA%26psc%3D1,EUME Tourismo 36L Laptop Backpack Bag with 2 Large Compartment for Work Office & Business Travel for Men & Women | Water Resistance | Fit Up to 16 Inch Laptop  ,"2,499",4.4 out of 5 stars,7,"2 Large Compartments 1 Easy access front Pocket with organizer section & 2 mesh side pocketCapacity : 36 L ; Dimensions : 13X9X19 Inch (LXWXH)Pretty much everything on this backpack is heavily padded. The laptop compartment is also super protective, so there's no need to worry about your laptop getting all banged and damaged. These bags are made of long lasting fabric and their stylish designs help you to make the best impression. It's features are such to make sure that every day is bright and organized.Laptop pocket designed for your laptops to give them maximum security. It comes with Ipad Pocket and Pen Pocket which aids in organising your things systematically. A comfortable breathable back and straps to strengthen your shoulder and hence ensures durability.A roller bag sleeve added feature to make your travelling even more comfortable and convenient. It is water resistance also so that your backpack never loses its good look.",B0B4JQSMD5,EUME Lifetsyle Pvt Ltd
https://www.amazon.in/Tabelito%C2%AE-Delta-Waterproof-Backpack-Compatible/dp/B0BLK1Z7DQ/ref=sr_1_99?crid=2M096C6104MLT&keywords=bags&qid=1690126151&sprefix=ba%2Caps%2C283&sr=8-99,"Tabelito® DELTA Casual Waterproof Laptop Backpack/Office Bag/School Bag/College Bag/Business Bag/Unisex Travel Backpack (Compatible with 15.6 inch Laptop) 30 L, (6 Month Warranty)  ",599,4.6 out of 5 stars,190,"LARGE CAPACITY: Delta Laptop Backpack for Travel, Business and Work with Lots of Space & Pockets --- Separate laptop compartment that can accommodate laptops up to 15.6 inches, and large main space with store books, wallets, clothes and other daily necessities. Multifunctional pockets in the main compartment can hold pens, cards, keys, etc. to keep your belongings in order. The external front zipper and two side pockets are also good choices for water bottle or umbrella.DAILY TRAVEL SUPPLIES: The Backpack has a padded laptop compartment that can fit 15.6 inch laptop. It can also accommodate essentials such as a Lunch box, Charger, Tablet, Books, Power Bank, Wallet, and Sunglass. Dimension(L*W*D): 44*32*16 cmERGONOMIC DESIGN: Thick cushioning around the shoulders and on the back panel makes the backpack super light and comfortable on the move. Water Resistant Material: Advanced IPX4 coating on the material ensures resistance to water entering from any direction.MULTI-LEVEL ORGANIZER: The backpack has a front zipper pocket for the ID card, Sanitizer, House keys, Pen. First compartment with pockets for the earphones, pens, notebook, Fitness Band. Spacious second compartment for all your electronics.MADE IN INDIA: TABELITO DELTA Casual Backpack is fully manufactured in India and pass through stringent quality tests and checks.The Tabelito Delta casual backpack comes with 6 month of warranty",B0BLK1Z7DQ,‎Tabelito Trade India
https://www.amazon.in/Nivia-5183NB-Gym-Navy-Blue/dp/B07NJGW3WX/ref=sr_1_100?crid=2M096C6104MLT&keywords=bags&qid=1690126151&sprefix=ba%2Caps%2C283&sr=8-100,NIVIA Beast Gym Bag-4 Polyester/Unisex Gym Bags/Shoulder Bag for Men & Women with Separate Shoes Compartment/Carry Gym Accessories/Fitness Bag/Sports & Travel Bag/Sports Kit (Navy Blue)  ,523,3.9 out of 5 stars,110,Highly water-resistant finish to save inner items from water splashesAdjustable shoulder strapTop grab handleOptimum quality of accessories and zipper for smoother functioning and high durabilityDurable zippers and enhanced by strong stitching at major stress points provide long-lasting durability against daily activities,,
https://www.amazon.in/AUXTER-BLACKY-Duffel-Emboss-Black/dp/B07F2H25NP/ref=sr_1_101?crid=2M096C6104MLT&keywords=bags&qid=1690126151&sprefix=ba%2Caps%2C283&sr=8-101,AUXTER Faux Leather 23 Cms Duffle Bag(AUX_GB_LE_Black -SE__0521_Black)  ,429,4.3 out of 5 stars,"9,248","Material / Dimension : Outer Material - Premium leatherette Fabric, Inner Material – Soft Polyester, Size: 43 cm x 23 cm x 23 cm. (L x B x H), Color : BlackCapacity: 23 Liters, 1 Large Double Zip Closure Compartment, 1 external Mesh Organizer Pocket for the earphones, ID card, Sanitizer, House keys, Fitness Band. 1 Main Compartment for all your Gym Clothes, Gym belt, towel, Gym gloves, shaker, shoe Pair etc.Design: Design with Self Embossed logo On the Premium Leatherette Heavy Quality Material. 3.8 Cm Wide and 125 cm Long Adjustable Handle and Double side easy carry handle.Manufacturing & Warranty: This Product is made in INDIA By “The INDIAN KARIGAR “ and pass though the many quality checks and tests This Product is come With 1 year of Warranty.Suitable: Auxter Black Gym Bag/ Duffel bag is suitable for gym, Day trip bag, casual round bag, travel bag is suitable for men women boys and Girls. This Bag is trending For Gift Purpose",Auxter,20 November 2017
https://www.amazon.in/F-Gear-Enzo-Waist-Bag-Enzo-Spruce-Yellow/dp/B08QM71P12/ref=sr_1_102?crid=2M096C6104MLT&keywords=bags&qid=1690126151&sprefix=ba%2Caps%2C283&sr=8-102,F Gear Enzo Sports Waist Bag (Enzo Spruce Yellow)  ,265,4.2 out of 5 stars,201,Care Instructions: Machine WashOne zippered compartment suitable for keys/napkins/wallet/mobile etc.One inside pocket with two small sleeves for credit card/passport etc. This fanny pack is suitable for only 250ml bottle.This fanny pack is water resistant.Premium YKK Japanese Zippers& sliders with an adjustable waist strap.Comes with The F Gear promise of quality and durability.,B08QM71P12,Uber Fashion Merchandise Pvt. Ltd.
https://www.amazon.in/uppercase-Professional-resistant-sustainable-Anti-theft/dp/B0BR1C59R8/ref=sr_1_103?crid=2M096C6104MLT&keywords=bags&qid=1690126151&sprefix=ba%2Caps%2C283&sr=8-103,"uppercase SealPro Professional Laptop Backpack (15.6 Inch) 3x more water resistant sustainable bags with rain proof zippers & Anti-theft for Men, Women, Boys and Girls, 750 Days warranty  ","1,900",4.6 out of 5 stars,69,"Care Instructions: Wipe with Damp ClothHandcrafted with care and made up of premium quality robust materialPadded anti-theft laptop compartment fits up to 15.6"" Laptop, Back padding with Air mesh; Pocket under flap and 2 mesh pocket inside main compartment with a bottle holder on the sideWrinkle free bag and 3x more water resistant with Rainproof zippers; Trolley sleeve to securely place the bags on the luggage; Top Slip In PocketGRS certified for sustainability; The GRS (Global Recycled Standard) is intended for use with any product that contains at least 50% Recycled Material (License No. CMPY-158596); 750 days of international warranty",B0BR1C59R8,Acefour Accessories Pvt. Ltd.
https://www.amazon.in/Pramadda-Pure-Luxury-Backpack-Bagpacks/dp/B0C6NNPZTC/ref=sr_1_104?crid=2M096C6104MLT&keywords=bags&qid=1690126151&sprefix=ba%2Caps%2C283&sr=8-104,Pramadda Pure Luxury Milan Casual Vegan Leather 15.6 inch Laptop Backpack for Men and Women | Stylish School College Office Travel Bagpacks | Trendy Office Laptop Bag For Men. (Classic Black)  ,"1,200",4.9 out of 5 stars,11,"Italian Milan Vegan Leather Casual Backpack for Men and Women. This Backpack looks very stylish and has decent space for all your essentialsIdeal Application : Office Laptop Backpack , School Bag for Senior Classes 11th 12th , College University Beg , Bike Tourister Bags , Fashion Bags for Men Women , Daily Travel Use Bags.Premium vegan leather laptop backpack for uber cool travellers as well as for office use and students. large compartment - with a dedicated laptop sleeve pocket for laptops upto 15.6 Inch and an additional pockets for tablets phones, power banks, keys, pens and other accessories.Features : Single Large Compartment with Laptop Sleeve | Quick Access Front Pocket | Padded Shoulder Straps | 2 side Pockets.18 months manufacturing warranty",B0C6NNPZTC,Pramodaa Overseas India | 7827-111-873
https://www.amazon.in/Lunars-Heritage-Casual-Bagpack-College/dp/B08CBJDBH4/ref=sr_1_105?crid=2M096C6104MLT&keywords=bags&qid=1690126151&sprefix=ba%2Caps%2C283&sr=8-105,Lunar's Heritage 37L Casual Water Resistant 3 Compartment Travel Bagpack/College Backpack/School Bag (Black)  ,799,4.0 out of 5 stars,877,"?WATER RESISTANT WITH 1 YEAR WARRANTY - Stylish and durable backpack for school /college, daily casual use and travel. . Size: 18.5 inch X 13.5 inch X 9 inch. Capacity : 37 liters. Backpack is made of high grade water resistant polyester material that gives it strength and durable for long-term use. 12 months warranty for any manufacturing defects<br><br> <br>?MADE IN INDIA - This “MAKE IN INDIA” Product features 3 large zippered compartments, 1 long zip pocket at front, 1 water bottle /umbrella pocket. Suitable for casual usage , school / college / office n travel.; ?LOTS OF STORAGE SPACE - Front compartment has space for keeping Tiffin box. Front pocket gives easy access to wallet / key chains/ stationery.<br><br> <br>?LOTS OF STORAGE SPACE - Second and third compartment are very spacious for keeping long Books, files, binders and spacious enough to hold your Travel / Trip cloths. The base is made with 100% super strong 900D polyester fabric to protect your bag during daily use<br><br> <br>?COMFY&STURDY - Comfortable airflow back design with thick but soft multi-panel ventilated padding, gives you maximum back support. Breathable and adjustable shoulder straps relieve the stress of shoulder. Padded handle and Reinforced haul loop for quick grab<br>; Age Range Description: Kid; Special Features: Water Bottle Umbrella Pouch<br>; Special Features: Water Bottle Umbrella Pouch; Age Range Description: Kid <br>Pattern Name: Solid <br>",B08CBJDBH4,Lunar's
https://www.amazon.in/ADISA-Laptop-Backpack-College-z-Black/dp/B09TPY1G1W/ref=sr_1_106?crid=2M096C6104MLT&keywords=bags&qid=1690126151&sprefix=ba%2Caps%2C283&sr=8-106,ADISA 15.6 inch Laptop Backpack Office Bag College Travel Back Pack 32 Ltrs (z-Black)  ,549,3.9 out of 5 stars,"1,016",Material: Water Resistant Light-Weight Polyester<br>Compartments: 2 with padding; Laptop Size: 15.6 inch and below<br>Dimensions: LxWxH - 12.5 x 7.5 x 19 inches<br>Reflector Logo / Adjustable Padded Shoulder Straps / 2 Bottle holders<br>Closure Type: Zipper<br>,B09TPY1G1W,ADISA
